id,text,stamp,speaker
45, Vous avez le pouvoir de répondre à ce que vient de dire E.Macron. Vous dépendez du pouvoir russe.,2022-04-20T19:37:20.985158Z, L.Salamé
46," E.Macron a accès à l'intégralité des informations des services français... Il sait pertinemment que ce qu'il dit est faux. Je suis une femme absolument et totalement libre. Je suis une patriote. Je l'ai démontré toute ma vie. La France et les Français, toujours, en toutes circonstances. J'ai retrouvé un tweet du 9 novembre 2014. ""Je soutiens une Ukraine libre qui ne soit soumise ni aux Etats-Unis, ni à l'UE, ni à la Russie."" Voilà ma position. C'était la même en Irak en 2003. C'est la même pour l'Ukraine aujourd'hui.",2022-04-20T19:37:28.958167Z, M.Le Pen
47, Mais l'Ukraine sans la Crimée.,2022-04-20T19:38:02.992841Z, E.Macron
48, Nous allons y venir. La Crimée n'a pas dû vous poser énormément de problèmes non plus. Vous avez reçu monsieur Poutine en grande pompe à Versailles.,2022-04-20T19:38:04.944152Z, M.Le Pen
49," Je l'ai reçu comme un chef d'Etat, pas comme un banquier.",2022-04-20T19:38:13.642546Z, E.Macron
50," En 2017. Vous avez reçu monsieur Poutine à Brégançon, sur votre lieu de vacances. A cette occasion, vous avez tenu les propos que je tiens. Vous avez dit, à cette occasion, que la Russie devait être réarrimée à l'Europe. Vous avez dit qu'il fallait faire l'Europe de Lisbonne à Vladivostok.",2022-04-20T19:38:17.808951Z, M.Le Pen
51, Ce que je dis est faux?,2022-04-20T19:38:45.226454Z, E.Macron
52, Je vais maintenant revenir sur le fond.,2022-04-20T19:38:48.923248Z, M.Le Pen
53," Je ne reviens sur aucune de mes déclarations, sur la Russie, dans le cadre de l'architecture de la sécurité européenne. C'est ce que j'ai défendu. J'ai parlé d'un point précis qui touche le financement de votre parti. Ce que j'ai dit est faux?",2022-04-20T19:38:50.224605Z, E.Macron
54, Oui. C'est faux et assez malhonnête.,2022-04-20T19:39:08.228638Z, M.Le Pen
55, Très bien. Tout ça est public. Nos compatriotes pourront le vérifier.,2022-04-20T19:39:10.616255Z, E.Macron
56," J'ai contracté un prêt à l'étranger. C'est de notoriété publique. C'est parce qu'aucune banque française n'a voulu m'accorder de prêt. A l'époque, vous trouviez ça tellement scandaleux que vous avez fait voter une loi sur la banque de la démocratie. Vous ne l'avez jamais mise en oeuvre. Pourquoi? Pourquoi n'êtes-vous pas allé au bout de cette banque de la démocratie, dont vous saviez qu'elle comblait un déficit démocratique des banques qui avaient l'air de choisir leur parti politique. Les banques choisissaient les candidats à soutenir ou non.",2022-04-20T19:39:15.702189Z, M.Le Pen
57," Vous avez contracté ce prêt en 2015. Vous ne l'avez toujours pas remboursé. Ce n'est pas un sujet de la banque de démocratie. D'autres candidats à cette élection, qui défendaient des idées comme les vôtres, comme monsieur Zemmour, ne sont pas allés contracter des prêts à l'étranger.",2022-04-20T19:39:53.824203Z, E.Macron
58," Nous remboursons sous le contrôle de la Commission nationale des comptes de campagne. Croyez-moi, cette commission est extrêmement sévère et rigoureuse. J'ai autre chose à vous dire. Des millions de Français, ces 5 dernières années, sont allés dans les banques françaises pour faire des prêts, pour acheter des voitures, faire un emprunt pour leur maison. Ils ne vous doivent rien. La seule chose qu'ils doivent, c'est rembourser un prêt, exactement comme moi.",2022-04-20T19:40:17.349759Z, M.Le Pen
59," Et comme votre serviteur. Simplement, ils vont dans des banques françaises pour payer leur voiture. Ils ne vont pas chercher plusieurs millions dans une banque russe liée au pouvoir, des millions qu'ils ne remboursent pas.",2022-04-20T19:40:48.923040Z, E.Macron
60, Je ne peux pas vous laisser dire...,2022-04-20T19:40:59.834236Z, M.Le Pen
61, C'est la réalité.,2022-04-20T19:41:02.217218Z, E.Macron
62," Je ne peux pas vous laisser dire qu'on ne rembourse pas. Nous remboursons tous les mois, rubis sur l'ongle, sous le contrôle de la Commission nationale des comptes de campagne.",2022-04-20T19:41:04.927177Z, M.Le Pen
63, Vous n'avez toujours pas remboursé ce prêt.,2022-04-20T19:41:13.132005Z, E.Macron
64," Nous sommes un parti pauvre. C'est long, c'est vrai. Mais ce n'est pas déshonorant.",2022-04-20T19:41:15.909998Z, M.Le Pen
65," Je ne considère pas que c'est déshonorant. Mon problème, et vous le reconnaîtrez avec moi, c'est que ça crée une dépendance.",2022-04-20T19:41:21.570793Z, E.Macron
66, Je n'ai pas d'autres dépendances que de rembourser mon prêt.,2022-04-20T19:41:28.943067Z, M.Le Pen
67," Votre prêt n'a pas été contracté auprès d'une banque lambda en Russie. C'est une banque proche du pouvoir. Chacun pourra le vérifier. Assumez-le! Beaucoup de vos choix s'expliquent par cette dépendance. Je ne vous en tiens pas grief. Je vous dis simplement que d'autres candidats, défendant des idées proches des vôtres, n'ont pas fait les mêmes choix. Ils ont trouvé des financements dans des banques françaises Vous avez fait un choix qui vous a ensuite contrainte dans votre position politique. Ca ne vous rend pas indépendante sur cette question.",2022-04-20T19:41:31.794508Z, E.Macron
68, C'est faux. Je vous le redis.,2022-04-20T19:42:08.922993Z, M.Le Pen
69," Vous pouvez asséner cette même phrase... On est tous à vous écouter. Moi aussi, j'ai des prêts avec des banques. Comme tous nos compatriotes, j'en ai eu, pour acheter une maison ou un véhicule. Aucun d'entre nous n'est allé le chercher auprès de banques russes, encore moins auprès de banques proches du pouvoir.",2022-04-20T19:42:10.852179Z, E.Macron
70," C'est un fait. Ca ne vous fait pas plaisir, mais c'est un fait.",2022-04-20T19:42:32.926627Z, E.Macron
71, C'est malhonnête de m'empêcher d'obtenir un prêt dans une banque française et de me reprocher après de partir à l'étranger. de trouver un prêt dans une banque française?,2022-04-20T19:42:40.946752Z, M.Le Pen
72, Vous étiez ministre de l'Economie.,2022-04-20T19:42:51.294166Z, M.Le Pen
73," J'étais ministre des Finances. En plus, personne n'est jamais intervenu. Vous le savez.",2022-04-20T19:42:53.538823Z, E.Macron
74, Il reste une question très importante à vous poser...,2022-04-20T19:42:59.319444Z, L.Salamé
75, Sans doute plus importante que cela.,2022-04-20T19:43:02.600344Z, M.Le Pen
76, Savoir d'où l'on part est toujours important.,2022-04-20T19:43:04.928273Z, E.Macron
77," Nous allons passer au sujet de l'UE. Il reste peu de temps sur le sujet de l'international. La question est simple. Elle vous est posée à l'un et à l'autre. Souhaitez-vous rester dans l'UE telle qu'elle est aujourd'hui, avec le couple franco-allemand comme moteur? Je regarde les chronomètres. E.Macron, vous avez un peu de retard. Vous avez la parole.",2022-04-20T19:43:07.701876Z, L.Salamé
78," Pour ma part, j'ai toujours été clair. Notre débat il y a 5 ans avait en grande partie porté sur ce sujet. Il y a 5 ans, 80 % du programme n'étaient applicables que si on sortait de l'euro. Ca avait tourné autour de l'euro ou de l'écu... On n'avait pas très bien compris ce qui se passait. Aujourd'hui, vous voulez toujours en sortir. En tout cas, vous ne le dites plus. Moi, je crois en l'Europe et je crois au couple franco-allemand. C'est ce qui nous a permis d'obtenir des accords, ce qui nous a permis d'avancer. Lors de la pandémie, la France ne produisait pas de vaccins à ARN messager. On était heureux d'en avoir en janvier 2021. On l'a fait parce qu'on a eu un accord européen. On est devenu le 1er continent producteur puis exportateur de vaccins, pour notre sécurité et celle des autres. Il y a d'abord eu un accord franco-allemand. Nous avons bâti une politique de solidarité financière, de mutualisation. Ensemble, nous avons commencé à mettre en place les fondements d'une Europe de la défense. Je suis convaincu que notre souveraineté nationale est européenne et que les 2 se complètent. C'est par l'Europe qu'on sera plus indépendants pour notre énergie, pour notre technologie, notre défense, notre agroalimentaire. Parler d'Europe, c'est aussi parler de nos agriculteurs. Ils savent combien l'Europe est importante pour eux. La PAC les aide à évoluer, à faire avancer cette nouvelle révolution que nous conduisons. Sur tous ces sujets, on a besoin d'une Europe plus forte, plus intégrée. Pour la faire avancer, il faut un couple franco-allemand de confiance. C'est ce que nous faisons aujourd'hui avec le chancelier O.Scholz. C'est la bonne ligne pour le pays.",2022-04-20T19:43:28.924220Z, E.Macron
79," Même question pour vous. Vous dites dans votre programme que vous souhaitez l'avènement d'une Europe des nations qui se substituerait progressivement à l'UE. Ca veut dire que vous voulez sortir de l'UE? L'UE telle qu'elle est aujourd'hui vous convient, avec le couple franco-allemand comme moteur?",2022-04-20T19:45:12.922577Z, G.Bouleau
80, Permettez-moi de dire à E.Macron qu'il n'y a pas de souveraineté européenne car il n'y a pas de peuple européen. Il y a une souveraineté quand il y a un peuple. Il y a une souveraineté française mais pas une souveraineté européenne. Vous souhaitez remplacer la souveraineté française par une souveraineté européenne. Vous l'avez fait symboliquement en remplaçant le drapeau français sous l'Arc de Triomphe par le drapeau européen.,2022-04-20T19:45:32.373657Z, M.Le Pen
81, Je ne l'ai pas fait.,2022-04-20T19:45:55.561264Z, E.Macron
82," L'Europe, ce n'est pas tout ou rien. Je souhaite rester dans l'UE. Je souhaite profondément la faire modifier pour effectivement faire émerger une alliance européenne des nations. Il y a toute une série de politiques de l'UE avec lesquelles je suis en désaccord. Je suis en désaccord avec la multiplication des accords de libre-échange, où on vend des voitures allemandes en sacrifiant les efforts, la concurrence des poulets du Brésil ou des boeufs du Canada. Je suis en désaccord avec la politique des travailleurs détachés. Des dizaines de milliers, des centaines de milliers, même, de travailleurs détachés viennent dans notre pays, travaillent et les charges qu'ils payent ne sont pas payées en France mais dans leur pays d'origine. Je suis opposée à la politique que vous avez soutenue de la ferme à la fourchette, qui vise à baisser de 10 à 20 % la production agricole européenne au moment où le monde est en train de faire face à une crise alimentaire qui va voir un certain nombre de pays être victimes des émeutes Il y a toute une série de politiques dont je me dis: ""Pourquoi la France n'arrive jamais à défendre ses intérêts?"" En tant que députée européenne, j'ai vu l'Allemagne défendre ses intérêts sur des dossiers. Je n'ai jamais vu des dirigeants français défendre les intérêts des Français, de la France, les intérêts des producteurs, des éleveurs et des industriels français. C'est ce que je souhaite faire. Je souhaite que la Commission respecte les nations souveraines, respecte leurs choix, y compris leurs choix de société, car nous faisons des choix de société. Par leur vote, les Français font des choix de société. La Commission européenne doit les respecter. Je veux faire évoluer cette organisation européenne, mais, monsieur Macron, je ne pensais pas que vous tomberiez dans une forme de complotisme. Je ne souhaite pas en sortir. Si je souhaitais en sortir, je le dirais. Si je ne dis pas que je souhaite en sortir, c'est que je ne souhaite pas le faire.",2022-04-20T19:45:57.282988Z, M.Le Pen
83," 80 % de votre programme était applicable sans euro, il y a 5 ans. Changer tout seul un club en réduisant sa cotisation, en disant ""je choisis mes règles"", soit les autres vous suivent... On est 27 autour de la table en Europe. Ce que vous décrivez ressemble à une bande à part, dans votre programme. Vous avez cité 2 choses importantes: les poulets brésiliens... Je veux vous informer que la France s'est opposée au Mercosur. J'ai justement porté une clause miroir. Quand on demande à nos agriculteurs et à nos industriels des choses, on demande la même chose aux autres. On a lutté contre la déforestation importée grâce à l'Europe. On s'est battus pour une PAC qui ne baisse pas malgré le Brexit. On se bat aujourd'hui... Les baisses de production ne sont plus adaptées au contexte. C'est la position française. Je vous en informe. Il faut produire plus en protégeant plus. Sur le travail détaché, il n'y a pas des centaines de milliers de travailleurs détachés. Il y a 500 000 tâches en France qui correspondent à 50 000 travailleurs détachés. Depuis 5 ans, je me bats pour changer cette Europe. Elle ne s'est pas faite spontanément, L'Europe que je décris. L'Europe des vaccins, l'Europe de la mutualisation de la dette... C'est une bataille française de chaque jour que j'ai menée depuis 5 ans. Je me suis battu dans le respect des autres. Sur le travail détaché, on a changé les règles. Pour avoir à travail égal, salaire égal. Pour lutter contre ce qui ne marchait pas. Quand j'essaie de comprendre ce qu'il y a derrière votre réforme du travail détaché, vous voulez quasiment le supprimer. Vous irez l'expliquer aux centaines de milliers de Françaises et de Français qui sont travailleurs détachés Beaucoup de transfrontaliers vivent avec ce système. Vous êtes dans des raccourcis qui ne marchent pas. Des valeurs de l'Europe et des règles du Conseil de l'Europe jusqu'au marché de l'énergie, dont vous proposez de sortir, jusqu'à Schengen, votre projet, quand on remet brique à brique les choses en place, c'est un projet qui consiste à faire sortir la France de l'Europe.",2022-04-20T19:48:28.623204Z, E.Macron
84, Ca s'appelle l'Europe des nations.,2022-04-20T19:50:54.245568Z, M.Le Pen
85," Vous sortez de l'UE, madame Le Pen. On peut décider de ripoliner tout seuls la façade. C'est une copropriété. Dans une copropriété, vous ne pouvez pas dire du jour au lendemain que ça s'appelle comme vous l'avez décidé parce que vous vous appelez M.Le Pen.",2022-04-20T19:50:56.974714Z, E.Macron
86, J'ai beaucoup plus d'ambition que vous.,2022-04-20T19:51:16.049135Z, M.Le Pen
87, J'ai fait avancer les choses. Mais je ne mens pas sur la marchandise. Vous mentez sur la marchandise.,2022-04-20T19:51:18.646607Z, E.Macron
88," Je ne mens pas sur la marchandise. Tout le monde sait que je défends l'Europe des nations. Tout le monde sait ce que je veux changer. Je le ferai avec des alliés. Vous me dites que vous avez obtenu des grandes avancées sur les travailleurs détachés. C'est faux. Vous avez juste obtenu qu'on arrête de frauder, c'est-à-dire que celui que le Français. Les charges continuent à être payées dans le pays d'origine. pour notre pays.",2022-04-20T19:51:24.274613Z, M.Le Pen
89, Vous avez raison.,2022-04-20T19:51:54.685980Z, E.Macron
90," Je peux terminer une phrase, s'il vous plaît, monsieur Macron? Ca crée une préférence étrangère dans un certain nombre de secteurs. Quand une entreprise fait appel à des travailleurs détachés, ça lui coûte moins cher. Par conséquent, les autres entreprises sont obligées de faire aussi appel à des travailleurs détachés. Cette préférence étrangère à l'emploi, je n'en veux pas. Mon objectif, ma priorité, mon obsession, c'est justement que les Français puissent travailler dans leur propre pays. C'est pour cela que je me bats. La valeur travail, trouver du travail, créer du travail et restituer le pouvoir d'achat aux Français.",2022-04-20T19:51:55.804620Z, M.Le Pen
91, Je voudrais dire...,2022-04-20T19:52:36.900204Z, E.Macron
92, On est malheureusement maîtres des horloges. On entend vos différences. Il faut passer aux retraites.,2022-04-20T19:52:40.985117Z, L.Salamé
93," Ce que dit madame Le Pen est vrai, mais la préférence nationale à l'emploi, c'est la fin du marché unique européen. Quand un Bulgare vient travailler en France, vous ne pouvez pas dire que vous n'en voulez pas. Vous ne pouvez pas demander à ce que nos travailleurs français puissent continuer à aller travailler en Allemagne, en Belgique ou dans d'autres pays européens. Vous avez plein de transfrontaliers qui font ça. Vous pensez qu'on peut faire la préférence nationale pour nous mais que les autres ne le demanderont pas. Le marché européen, c'est un marché de libre circulation des travailleurs et de libre circulation des marchandises. Vous proposez de le casser.",2022-04-20T19:52:49.204411Z, E.Macron
94, On évoquera sûrement la priorité nationale au moment des institutions. Vous êtes très européanocentré.,2022-04-20T19:53:28.976203Z, M.Le Pen
95, Je suis aussi français que vous.,2022-04-20T19:53:37.849049Z, E.Macron
96," La France est une puissance mondiale, pas seulement européenne. On n'a pas parlé de l'Afrique, avec laquelle il faut évidemment développer de nouvelles relations. On n'a pas parlé de nos outre-mer, qui sont des plates-formes...",2022-04-20T19:53:40.252180Z, M.Le Pen
97," Ce n'est pas l'étranger, madame Le Pen.",2022-04-20T19:53:52.961592Z, E.Macron
98," Nos outre-mer sont des plates-formes d'influence de la France, justement régionales, à l'égard des pays alentour. On n'a parlé de rien de tout cela parce que vous avez une vision qui rabougrit la France. La France est un pays, dans votre esprit, qui est devenu C'est un pays mondial. Elle doit retrouver cette ambition de grandeur, d'influence dans le monde, y compris avec des partenaires privilégiés, notamment des pays francophones d'Afrique, qui sont des partenaires historiques, avec lesquels il faut refonder une relation en oubliant la terrible...",2022-04-20T19:53:57.830080Z, M.Le Pen
99," C'est effarant de voir avec quel cynisme vous avancez. Vous expliquez que le marché européen, finito. Pareil sur les marchandises parce que vous remettez des contrôles aux frontières en mettant autant de douaniers qu'en 1990. C'est dans votre programma. Vous parlez de rabougrissement. sur le rabougrissement sur les frontières nationales. Vous avez fait une conférence sur l'international l'autre jour et vous n'avez pas eu un mot sur l'Afrique. J'ai fait plus de voyages qu'aucun de mes prédécesseurs sur le continent africain. Je tiens à ce continent. Je regardais avec lucidité et courage notre histoire sur ce sujet. Ce n'est pas votre cas. Quand ils vous regardent, ils sont médusés. Vous voulez faire de la France le 1er pays au monde qui interdira le voile sur la voie publique. Vous voulez faire de notre pays un pays...",2022-04-20T19:54:40.990337Z, E.Macron
100, E.Macron...,2022-04-20T19:55:41.179380Z, G.Bouleau
101," Vous voulez être une grande puissance mondiale qui rayonne. Le projet que vous portez est un projet de rétrécissement, attentatoire à l'universalisme français. C'est normal. C'est le projet du Front national depuis le début de son histoire. C'est une réalité.",2022-04-20T19:55:45.049177Z, E.Macron
102, Vos propos sont confus.,2022-04-20T19:55:58.745925Z, M.Le Pen
103," Vous aurez tout loisir... Vous aurez tout loisir, l'un et l'autre, de parler",2022-04-20T19:56:00.953498Z, G.Bouleau
104," On est obligés de passer aux thèmes suivants. Vos échanges sont passionnants. Les Français voient précisément vos différences sur l'international et l'Europe, mais on doit passer à un thème qui a été très débattu dans cette campagne. Là encore, on voit vos désaccords. Jusqu'à quel âge devrons-nous travailler si vous êtes élus, l'un et l'autre? Vous avez l'un et l'autre évolué récemment sur cette question. Les Français ont parfois du mal à comprendre ce que vous proposez précisément. M.Le Pen, vous présidente, en 2027, à la fin de votre quinquennat, à quel âge les Français partiront à la retraite?",2022-04-20T19:56:08.950922Z, L.Salamé
105," Ils partiront à la retraite entre 60 et 62 ans pour avoir une retraite pleine. Il leur faudra entre 40 et 42 annuités. Dans le choix que j'ai fait, parce que philosophiquement, je considère que le système de protection sociale, c'est le bien de ceux qui n'en ont pas, le patrimoine de ceux qui n'en ont pas. Il s'exprime par la solidarité nationale. J'y suis profondément attachée. C'est l'un des éléments de la Ve République. Dans ce système de protection sociale, la retraite a un rôle extrêmement important. La justice nécessite de considérer que plus on travaille tôt, plus on travaille dur, plus il faut partir tôt. Par conséquent, je propose un système progressif. Tous ceux qui auront eu un 1er emploi significatif avant l'âge de 20 ans, entre 17 et 20 ans, pourront partir à la retraite à 60 ans après 40 annuités. Au fur et à mesure de l'âge auquel on rentre dans le système, on atteindra maximum 42 annuités, 62 ans. C'est fort différent du projet de monsieur Macron, qui veut faire travailler tout le monde jusqu'à 65 ans. Permettez-moi de rappeler, parce que les amis de monsieur Macron ont essayé de créer une incertitude et une inquiétude auprès des Français, que tout dispositif particulier, carrière longue et autres, sera évidemment prioritaire sur ma réforme. Si quelqu'un a, grâce à un dispositif de carrière longue, un bénéfice plus avantageux pour lui, c'est le système de carrière longue qui s'appliquera. Mais la retraite à 65 ans, c'est une injustice absolument insupportable, monsieur Macron. Envisager que les Français partent à la retraite alors qu'ils ne seront plus capables d'en profiter, alors que, très certainement, la majorité d'entre eux ne seront plus en activité, parce que déjà, à 62 ans et 8 mois, la moitié sont en inactivité au moment où ils prennent leur retraite... Envisager que plus personne ne puisse avoir une retraite pleine car plus personne n'arrivera à cet âge-là, avec le nombre d'annuités qui va évidemment augmenter aussi... Si vous augmentez l'âge de départ à la retraite, vous augmentez évidemment le nombre d'annuités. Je suppose. On n'a pas réussi à trop savoir. Darmanin a dit 40. G.Attal a dit 42 ou 43. Quoi qu'il en soit, je considère que c'est profondément injuste et absolument pas justifié sur le plan budgétaire, contrairement à ce que vous dites.",2022-04-20T19:56:42.978782Z, M.Le Pen
106," E.Macron, même question qu'à M.Le Pen. Si vous êtes réélu président de la République, pouvez-vous dire clairement aux Français à quel âge ils partiront à la retraite à la fin d'un éventuel 2d quinquennat, en 2027?",2022-04-20T19:59:21.144372Z, G.Bouleau
107," Oui. On a beaucoup de progrès à financer. On l'a fait durant ce quinquennat, sur la santé et sur d'autres sujets. On a continué, en particulier pour le grand âge et pour permettre l'autonomie... On a aussi amélioré le niveau des retraites. Y compris pour toutes celles et ceux qui sont à la retraite, je propose de passer au minimum contributif, c'est-à-dire une carrière complète, à 1100 euros. Je pense qu'il faut une différence. Je propose de passer le minimum contributif, qui est de 980 euros, à 1100 euros. Ces progrès, il faut pouvoir les financer. Avant même ces progrès, notre régime est déséquilibré. Il l'est jusqu'au milieu des années 2030, selon l'organisme indépendant, le COR. Les actifs payent pour les retraités. Je ne veux pas d'un projet qui fragilise les pensions de nos retraités. Vous n'êtes pas claire là-dessus. Je veux continuer d'améliorer les pensions et de les mettre à 1100 euros pour ceux qui ont une carrière complète. Je ne veux pas que les impôts augmentent. Je suis crédible. Je les ai baissés pendant ce quinquennat, de 50 milliards d'euros, dont 25 milliards pour les ménages. Les impôts sur le revenu ont baissé. Je suis crédible. Je ne vais pas remonter les impôts. Je veux qu'ils baissent. Je ne veux pas augmenter notre dette. Je veux commencer à rembourser. Les Français me font confiance. Il n'y a qu'une manière de financer, c'est de travailler progressivement plus, avec un pilier, le plein-emploi. Pour moi, le travail est un fil rouge. Il s'agit de réussir à faire comme ce que l'on a fait sous ce quinquennat. Le 2e pilier, c'est de décaler l'âge légal de 4 mois par an. Vous atteindrez, en 2028, 64 et en 2031, 65. Ce n'est pas du jour au lendemain, comme vous le laissez entendre. C'est 4 mois par an, en prenant en compte plusieurs dispositifs. Le premier, c'est la carrière longue. Il faut garder ce dispositif. Le 2e, c'est la pénibilité. Vous proposez de supprimer le système de pénibilité. Nous 4, objectivement, il est vraisemblable que l'on travaillera au-delà de 65 ans. Il faut de la liberté. Il s'agit de protéger ceux qui ont des métiers pénibles, pour qu'ils partent bien avant.",2022-04-20T19:59:36.977294Z, E.Macron
108," A 60 ans et 40 annuités, par exemple.",2022-04-20T20:02:26.928173Z, M.Le Pen
