id,text,stamp,speaker
0,"A l'évidence, nous parlons d'une époque où les peurs sont là. la vie meilleure pour nos enfants. Notre France sera plus forte si elle sait se saisir de la question écologique. Ces dernières Années, nous l'avons fait. Dans le moment que nous vivons, c'est très important. Voilà les mots qui me paraissent importants. C'est ce qui guidera mes choix dans les années qui viennent.",2022-04-20T19:06:08.668781Z,
1," Si vous le voulez bien, on va commencer par le 1er thème de ce débat, le pouvoir d'achat. Les prix ne cessent d'augmenter, encore plus depuis le début de la guerre en Ukraine. Les Français le ressentent tous les jours au moment de payer leurs courses, de mettre de l'essence dans la voiture ou de régler la facture du chauffage. M.Le Pen, vous avez la parole. L'inflation risque de s'installer dans la durée. Qu'allez-vous faire pour aider les Français?",2022-04-20T19:06:55.240910Z, L.Salamé
2," Je suis obligée, là encore, d'être la porte-parole des Français. Monsieur Macron, je vous ai entendu, avec votre gouvernement, vous réjouir d'avoir augmenté le pouvoir d'achat des Français. Moi, je n'ai vu que des Français qui m'ont parlé de leurs problèmes de pouvoir d'achat. Je n'ai vu que des Français me dire qu'ils n'y arrivaient plus, qu'ils n'arrivaient plus à boucler leurs fins de mois. 7 Français sur 10 considèrent qu'ils ont perdu du pouvoir d'achat depuis 5 ans. Vous avez fait des choix. Vous avez fait le choix de mettre en place la taxe carbone. Elle a aggravé le prix de l'essence. Vous avez fait le choix de baisser des aides essentielles pour un certain nombre de nos compatriotes, notamment l'aide au logement, de 5 euros. Je veux véritablement faire du pouvoir d'achat la priorité de mon prochain quinquennat, si les Français me font confiance. Par l'intermédiaire de 3 leviers, je le ferai. Je vais d'abord baisser les dépenses contraintes. Je veux proposer de baisser de manière pérenne la fiscalité. Pas avec des chèques, des tickets de rationnement. Je veux le faire de manière pérenne. Je vais baisser la TVA sur l'énergie, l'ensemble de l'énergie, à 5,5 %. Je considère que l'énergie est un bien de première nécessité. Je veux la baisser sur le carburant, le gaz, l'électricité et le fioul. Je vais ainsi rendre 12 milliards aux Français. Je vais aussi leur rendre du pouvoir d'achat par l'intermédiaire de baisses de la fiscalité. Je vais restituer la demi-part fiscale aux veuves et aux veufs. Je souhaite exonérer d'impôt sur le revenu les moins de 30 ans. Je souhaite accorder aux familles une part pleine fiscale dès le 2e enfant, pour augmenter leur pouvoir d'achat de 560 euros par an. Je veux aussi soutenir la valeur travail. C'est mon 2e levier. Il s'agit de revaloriser un certain nombre de catégories, notamment les soignants et les enseignants, qui sont particulièrement maltraités, en dessous de la moyenne européenne. C'est aussi soutenir les alternants, les apprentis, les étudiants qui travaillent, par des compléments de revenus de 200 à 300 euros. Le dernier secteur sur lequel je veux intervenir, ce sont les personnes vulnérables. Pendant votre quinquennat, elles ont été maltraitées. Je veux revaloriser la politique à destination des personnes vulnérables. Je veux donc doubler les allocations pour les familles monoparentales. C'est individualiser aussi l'allocation adulte handicapé. Quand je dis individualiser, c'est la déconjugalisation, pour ceux qui connaissent mal ce système... En réalité, vous avez pris la décision de vous opposer au fait de pouvoir accorder l'allocation adulte handicapé, quel que soit le revenu du conjoint, en créant une dépendance sur une dépendance. Il y a aussi le sujet des retraités, l'indexation des retraites. Elle n'a pas été respectée, c'est le moins que l'on puisse dire, ces 5 dernières années. Voilà véritablement une priorité absolue des 5 prochaines années: restituer aux Français leur argent. L'ensemble de ces mesures permettra de leur rendre en moyenne 150 à 200 euros par mois et par foyer. Bien sûr, pour faire cela, il faut faire des choix. Je fais des choix. Je fais le choix de faire des économies sur des dépenses qui m'apparaissent dispendieuses ou nocives, ce que je considère comme de l'argent qui s'enfuit parce que personne ne s'y est attaqué de manière sérieuse.",2022-04-20T19:07:21.573558Z, M.Le Pen
3," Vous avez consacré 4 minutes à votre réponse. E.Macron, même question. Qu'allez-vous faire pour aider les Français sur ce point particulier, le pouvoir d'achat?",2022-04-20T19:11:25.528362Z, G.Bouleau
4," Madame Le Pen a raison de dire que les chiffres, qui ne sont pas les miens mais ceux d'organismes indépendants, établissent que le pouvoir d'achat, en particulier celui des Français qui travaillent, les classes moyennes, a augmenté. Mais les chiffres, en moyenne, ne viennent pas aider à finir le mois quand la vie devient plus chère. C'est une réalité. Je partage totalement ce que vous avez dit. J'ai les mêmes retours de mes déplacements sur le terrain. J'en ai fait plus de 600 durant ces 5 dernières années. Il y a une colère, avec les caddies qu'on n'arrive plus à remplir... Ce que nous avons fait, ce que je veux maintenir, c'est que, face aux prix de l'énergie, je veux maintenir le bouclier. Ca consiste à bloquer les prix sur l'électricité et le gaz. C'est 2 fois plus efficace que la baisse de la TVA. C'est pour ça que je me permets de le dire. Les Français auront une augmentation de leur facture de plusieurs dizaines ou centaines d'euros par mois si vous deviez être élue. Vous avez voté contre ce bouclier énergétique. Quand on bloque une augmentation qui est de 40, 60, 100 % pour certaines énergies, on se retrouve avec des chiffres problématiques. La 1re chose, c'est de maintenir ce bouclier aussi longtemps que la crise sera là. C'est un dispositif de crise et je l'assume. C'est la différence avec vous. C'est 2 fois plus efficace que vous. La 2e différence, c'est que ça n'est pas pérenne. Vous l'avez très bien décrit. C'est un dispositif de crise. Quand on reviendra à des prix traditionnels, j'assumerai de ne pas subventionner le gaz et le pétrole qu'on ne produit pas. Je veux plutôt dépenser l'argent public pour aider les ménages pour changer de véhicule ou rénover leur logement. On a commencé à le faire. La 2e chose, c'est le travail. Je suis fier que tous ensemble, nous ayons permis de créer 1,2 million de feuilles de paye. Je regardais votre programme, vos 22 mesures. Il n'y a même pas le mot ""chômage"" dedans. C'est frappant. C'est une reconnaissance du travail bien fait pour les 5 années qui viennent de s'écouler. Je vous en remercie. La meilleure façon de gagner du pouvoir d'achat, c'est de lutter contre le chômage. Nous avons baissé le chômage de plus de 2 points. 1,2 million de Français ont retrouvé un travail. Je veux aller plus loin. Le Smic sera augmenté de 34 euros par mois. Même chose pour les plus petites rémunérations dans la fonction publique, avant la reprise du point d'indice à l'été. Les retraites moyennes seront augmentées d'environ 60 euros par mois pour une retraite de 1400 euros. On ne va pas attendre le 1er janvier prochain. Là, on a une inflation à plus de 4 %. Pour les plus petites pensions, elles seront portées à 1100 euros pour quelqu'un qui a une carrière complète. Pour tous les travailleurs, il y a un point qui me paraît très important, le dividende salarié. Lorsqu'un patron, que ce soit une PME ou un très grand groupe, verse du dividende à ses actionnaires, il doit verser de l'intéressement. La prime pouvoir d'achat sera portée à 6000 euros, sans charges pour l'employeur et sans impôts pour le salarié. Cette prime a été créée il y a 3 ans. Elle était plafonnée à 1000 euros. Ce sera porté à 6000 euros. Enfin, concernant les minima sociaux, je souhaite les revaloriser cet été, et en même temps, rendre le système plus simple, pour avoir un système de solidarité à la source. Si vous y avez droit, vous les toucherez. Ca permettra de lutter contre la fraude et contre le non-recours. Voilà mes mesures de pouvoir d'achat. C'est à la fois un blocage des prix et une revalorisation du travail. L'allocation adulte handicapé a été revalorisée durant ce quinquennat, 90 euros par mois. Je suis favorable à ce que l'on puisse corriger cet effet de bord, que vous avez très bien décrit. Quand une personne touche cette allocation et se marie avec quelqu'un qui a plus d'argent, elle perd cette allocation. Le gouvernement n'a pas soutenu cette mesure, c'est vrai.",2022-04-20T19:11:38.051363Z, E.Macron
5, Il faut quelque chose de pérenne et non pas de provisoire.,2022-04-20T19:17:07.342959Z, M.Le Pen
6, Vous avez voté contre le blocage des prix.,2022-04-20T19:17:10.328548Z, E.Macron
7, Qui paye le bouclier? Les contribuables.,2022-04-20T19:17:12.951025Z, M.Le Pen
8, Comme la baisse de la TVA.,2022-04-20T19:17:16.223492Z, E.Macron
9," A chaque fois, c'est d'un côté ou de l'autre. J'ai des économies par ailleurs. Vous me dites que le blocage est plus efficace que ma TVA. Ce n'est pas possible. Comme je conserve le blocage et que je vais revenir à des prix régulés, ce que vous ne souhaitez pas faire, ces mesures vont s'accumuler. J'ai fait un petit calcul pour le fioul. Pour une cuve de fioul de 2000 euros, c'est 590 euros pensent qu'un président de la République puisse décider de ce qui est sur la fiche de paye...",2022-04-20T19:17:18.412368Z, M.Le Pen
10, Il s'agit d'une incitation auprès des entreprises.,2022-04-20T19:19:18.089271Z, M.Le Pen
11, Il n'y aura pas d'augmentation de 10 %. Je propose de défiscaliser la prime. Vous n'allez pas le décider pour l'employeur.,2022-04-20T19:19:21.760048Z, E.Macron
12, Ca va changer leur vie quotidienne.,2022-04-20T19:19:28.639525Z, M.Le Pen
13," Vous n'allez pas le décider pour l'employeur. Vous n'allez pas faire les salaires, madame Le Pen.",2022-04-20T19:19:30.824292Z, E.Macron
14," Vous ne ferez pas non plus les primes, monsieur Macron.",2022-04-20T19:19:36.928310Z, M.Le Pen
15," Je ne le dis pas. J'enlève les charges du côté employeur, les impôts. Vous essayez de faire croire que vous allez augmenter les salaires de 10 % et que ce sera récurrent. Non, ce n'est pas vrai. Quand vous employez de manière durable une augmentation de salaire, c'est une charge pour l'entreprise, votre vie s'améliore, mais il faut que dans la durée, la situation de l'entreprise le permette. Les artisans et les entrepreneurs qui nous écoutent le savent. La nature n'est pas la même. Le salaire ne va pas augmenter de 10 %. Je peux revenir au blocage des prix? Je suis content d'apprendre que vous le maintenez. Vous avez voté contre quand il est passé à l'Assemblée. Pourquoi?",2022-04-20T19:19:40.155712Z, E.Macron
16, Parce que je souhaite changer le système de fond en comble.,2022-04-20T19:20:21.560530Z, M.Le Pen
17," D'accord, mais vous avez voté contre le blocage des prix.",2022-04-20T19:20:25.878391Z, E.Macron
18," Je veux restituer aux Français des prix de l'énergie qui sont la conséquence de l'investissement de leurs parents, de leurs grands-parents...",2022-04-20T19:20:33.008936Z, M.Le Pen
19, C'est autre chose.,2022-04-20T19:20:40.955310Z, E.Macron
20," Ce n'est pas autre chose. Vous voyez bien que si nous avions des prix régulés, comme nous les avions antérieurement, nous serions beaucoup moins sensibles à l'évolution que nous vivons aujourd'hui des prix de l'énergie, qui sont la conséquence aussi d'un prix de l'énergie qui est fixé au niveau européen et qui n'est pas fixé sur nos prix de production à nous, qui étaient très bas, qui ont d'ailleurs fait le bonheur des particuliers français et la compétitivité pendant des années des entreprises françaises. Mais sur l'ensemble des erreurs idéologiques effectuées par nos voisins, notamment nos voisins allemands, qui sont très dépendants du gaz russe et donc très dépendants des variations liées à des difficultés géopolitiques. Je termine. Moi, je suis parfaitement d'accord pour mettre une mesure supplémentaire... Toutes les mesures dont je viens de vous parler sont pérennes. C'est une mesure conjoncturelle: la suppression totale de la TVA, la TVA à 0 %, sur un panier de 100 produits de première nécessité, d'hygiène ou alimentaires, tant que l'inflation est supérieure de 1 point à la croissance. C'est évidemment le cas actuellement.",2022-04-20T19:20:41.179028Z, M.Le Pen
21, Ah bon?,2022-04-20T19:22:12.182122Z, E.Macron
22," Oui, oui.",2022-04-20T19:22:13.878178Z, M.Le Pen
23, Dans les chiffres constatés ou prévus?,2022-04-20T19:22:16.980895Z, E.Macron
24, Dans les chiffres prévus.,2022-04-20T19:22:18.063967Z, M.Le Pen
25," Vous n'êtes pas d'accord, E.Macron, avec ce que dit M.Le Pen?",2022-04-20T19:22:20.183579Z, L.Salamé
26," D'après les chiffres du 2e trimestre, l'inflation est de 4,5 % et la croissance de 0,6 %. Dans les prévisions de la Banque de France, la croissance est de 2,8 % et l'inflation de 4,4 %. Cette mesure se mettra en place rapidement. Ca démontre que la situation est difficile.",2022-04-20T19:22:29.886663Z, M.Le Pen
27," Je me félicite que malgré un vote négatif en tant que députée de la République quand il s'est agi de mettre en place le bouclier, qui est une mesure efficace, vous vouliez le garder. C'est une correction de jugement. La réforme du marché européen ne se fait pas en un mois, madame Le Pen. Il y a une différence entre vous et moi. Vous avez déclaré vouloir sortir du marché européen de l'énergie. C'est une immense erreur. Nous sommes interconnectés. Nous avons des moments où nous importons l'énergie que nous ne produisons pas sur le sol français. Nous avons besoin des marchés européens car nous sommes interconnectés. C'est ce que la France a entrepris sous sa présidence... Il faut pouvoir réformer le marché de l'électricité pour qu'il ne dépende plus des petites parts additionnelles de gaz qu'on importe, mais de la base installée, qui est beaucoup plus nucléaire. C'est ce qui permettra de baisser les prix. Même quand on lance cette réforme, on doit faire le bouclier. C'est pour ça qu'on l'a fait. Je regrette que vous ayez voté contre. Sur la TVA sur les produits alimentaires, je propose C'est comme le chèque inflation. Je voudrais qu'il touche les étudiants précaires, les modestes, les ménages qui sont à l'euro près. C'est plus efficace et plus juste. Pourquoi? D'abord parce que la TVA à 0 % sur les produits alimentaires que vous proposez n'est pas une mesure efficace car très peu répercutée. Ca fera 13 euros par an. Je ne me risquerai même pas sur ces chiffres. Quand on a baissé la TVA pour nos restaurateurs, c'était une très bonne mesure. Le président Sarkozy avait raison. C'était pour aider nos restaurateurs à embaucher, à repartir. Là, votre baisse de la TVA va aller aux grands distributeurs beaucoup plus qu'aux consommateurs. En plus, votre mesure est injuste. Vous et moi, on n'a pas besoin de payer 0 % de TVA sur ces biens. On veut que les ménages qui sont à l'euro près, qui n'arrivent pas à compléter leur caddie, puissent toucher quelque chose. Le chèque est plus adapté que la baisse de la TVA qui n'est pas ciblée. Ca va nous coûter des milliards alors que ça va profiter à des gens comme nous qui n'en avons pas besoin. Quand je regarde les chiffres de la Banque de France, le taux d'inflation est de 3,7 en 2022. Quand je regarde les chiffres réalisés... Vous avez parlé d'une inflation à 4,5 %. Les chiffres trimestriels de croissance sont de 5,4. J'ai regardé les chiffres.",2022-04-20T19:22:53.663240Z, E.Macron
28, Il y a un point de différence et ça s'appliquera.,2022-04-20T19:25:31.063106Z, M.Le Pen
29, Dans aucun cas votre dispositif ne peut s'appliquer aujourd'hui.,2022-04-20T19:25:38.657443Z, E.Macron
30, Il y a quand même quelque chose d'étonnant. Vous bloquez les prix mais vous auriez pu baisser les taxes que vous avez augmentées.,2022-04-20T19:25:42.488761Z, M.Le Pen
31, Je fais plus que les rendre.,2022-04-20T19:25:50.090666Z, E.Macron
32," Vous avez mis beaucoup de temps à le faire. C'est parce que vous avez augmenté les taxes sur le carburant que ça a déclenché des problèmes de pouvoir d'achat pour les Français, mais aussi la crise des ""gilets jaunes"". Vous avez suspendu cette hausse. Vous ne l'avez pas retirée. Vous ne l'avez pas retirée de la loi. Elle pourrait éventuellement demain reprendre la trajectoire d'augmentation que vous aviez envisagée. Je veux rendre leur argent aux Français. Vous faites encore une fois des chèques. Je vous dis que les chèques sont inflationnistes. Ca a toujours été le cas dans toutes les économies. Ca entretient l'inflation. Les commerçants se disent: ""Comme il va y avoir un chèque, autant maintenir les prix hauts."" La suppression de la TVA est désinflationniste. Vous mettez en oeuvre des mesures qui risquent d'aggraver la situation. Je suis navrée de voir que les mesures que vous proposez sont en même temps inefficaces, parfois mal calibrées. J'ai vu que le chèque de 100 euros que vous aviez adressé, même des détenus dans les prisons les avaient touchés pour compenser Il est beaucoup plus simple de rendre de manière pérenne leur argent.",2022-04-20T19:25:52.942616Z, M.Le Pen
33," E.Macron, vous avez une petite minute",2022-04-20T19:27:24.817102Z, G.Bouleau
34," Vous n'avez répondu à aucune de mes remarques. Je pense que vous n'avez pas de réponse. Vous n'y avez pas répondu. Ce que vous avez dit est factuellement faux. Les boucliers que nous avons mis en place, les chiffres le constatent, font que la France a 2 fois moins d'inflation 60 % de moins que l'Allemagne. Le bouclier qu'on a mis en place n'est pas inflationniste. Il évite que la hausse qui ne se répercute pas sur les ménages ne se traduise pas par ailleurs. Vos mesures ne sont pas ciblées du tout. Vous baissez la TVA pour nous 4. Elles sont inefficaces parce qu'elles ne seront pas transmises dans les prix. Elles sont injustes. Vous n'avez pas répondu. Vous êtes à peu près au même temps de parole sur le pouvoir d'achat. On passe à l'international.",2022-04-20T19:27:28.952526Z, E.Macron
35," Bravo à vous. Autre chapitre très important: l'international. Le 24 février, l'Ukraine, pays indépendant et reconnu pays européen, a été envahie et agressée par la Russie. Que doit faire la France? Jusqu'où doit-elle aller pour aider l'Ukraine? E.Macron.",2022-04-20T19:28:21.484786Z, G.Bouleau
36," D'abord, vous avez raison de poser la question internationale avec le retour de la guerre sur notre continent. Nous vivons des moments d'une extrême gravité. La Russie a décidé d'accroître son offensive. Les prochaines heures, les prochains jours, seront marqués par une offensive de plus en plus massive sur l'est de l'Ukraine, le Donbass, sur Marioupol, avec des drames humains comme ceux que nous avons constatés dans plusieurs villes. Le rôle de la France et le rôle de l'Europe, c'est, comme nous l'avons fait depuis le début, d'abord de soutenir l'Ukraine. On aide les Ukrainiens avec des équipements de défense et des équipements pour combattre. On soutient l'Ukraine financièrement. C'est ce que nous avons fait et refait. On soutient le peuple ukrainien. 5 millions d'Ukrainiens et d'Ukrainiennes ont quitté l'Ukraine pour rejoindre l'Europe.",2022-04-20T19:28:41.392226Z, E.Macron
37, Faut-il aller plus loin? C'est ce que vous demandait G.Bouleau.,2022-04-20T19:29:41.843825Z, L.Salamé
38," Il faut intensifier et tenir cette ligne avec beaucoup de force, en veillant, comme je le fais depuis le début, à ce que cette guerre n'aille pas dans une escalade et ne s'étende pas. Il nous faut renforcer en parallèle la tenaille que nous mettons en place avec les Européens et les alliés. Il nous faut également tenir les autres pays. C'est pour ça que j'ai sans cesse discuté avec la Chine, l'Inde et les pays du Golfe, pour qu'ils puissent prendre conscience que la Russie choisit une voie funeste, pour l'Ukraine au premier chef, mais pour elle-même et pour l'équilibre des nations. C'est pour ça que l'Europe est aussi importante. Une Europe avec des puissances de défense fortes. J'ai réinvesti massivement dans nos armées pour avoir un modèle complet d'armée, pour aller jusqu'aux 50 milliards. Je veux faire de la France et de l'Europe une puissance d'équilibre qui permet d'assurer notre défense dans la durée. Il faut éviter l'élargissement du conflit. Nous ne sommes les vassaux de personne. Il faut progressivement ramener la Russie à la raison pour cesser le feu puis libérer",2022-04-20T19:29:48.643435Z, E.Macron
39," On va reparler de l'UE et de l'Europe. Vous n'avez pas exactement la même vision de ce que doit être l'UE. pour vous, M.Le Pen: doit-on aider davantage l'Ukraine et lui livrer des armes? Faut-il aller plus loin?",2022-04-20T19:30:56.967161Z, L.Salamé
40," Permettez-moi d'évoquer, devant nos millions de compatriotes, ma solidarité et ma compassion absolues avec le peuple ukrainien. Je considère que l'agression dont l'Ukraine a été victime n'est pas admissible. Les efforts que vous avez développés pour tenter de trouver, au nom de la France, les moyens, les voies de la paix, méritent d'être soulignés. C'est très clair. L'aide à l'Ukraine, oui, bien sûr. L'aide financière, oui. L'aide avec du matériel de défense, oui. Le maire de Perpignan est allé jusqu'à la frontière polonaise pour ramener des réfugiés, des femmes, des enfants, des personnes âgées, tous d'Ukraine, pour les mettre en sécurité à Perpignan. La Pologne en est à près de 3 millions de réfugiés accueillis. Les alertes que j'avais pu lancer, c'était la limite entre l'aide et la cobelligérance en matière de livraison d'armes. L'autre limite, c'étaient les sanctions. J'étais d'accord sur l'intégralité des sanctions prises contre les oligarques, les banques. La seule sanction avec laquelle je suis en désaccord, c'est le blocage de l'importation du gaz et du pétrole russes. Pourquoi? Je pense que ce n'est pas la bonne méthode. Ce n'est pas ce qui fera du mal à la Russie. Surtout, ça va faire énormément de mal au peuple français. Les conséquences de ce blocage, dont on nous annonce d'ailleurs qu'il serait négocié par l'UE après l'élection présidentielle française, seraient cataclysmiques, et pas seulement sur les particuliers. Ce serait cataclysmique pour les entreprises. On ne peut pas se faire hara-kiri avec l'espoir de faire du mal financièrement à la Russie, qui ira certainement vendre son gaz et son pétrole à d'autres pays. C'était la seule limite que j'avais exprimée. J'ai aussi exprimé une crainte. C'est une crainte ancienne de notre pays, une crainte ancienne d'autres puissances du monde, celle de faire en sorte que la Russie et la Chine deviennent des alliés étroits, au point de constituer, demain, parce que gouverner, c'est prévoir les dangers de demain et d'aujourd'hui, une superpuissance économique, monétaire, peut-être même militaire, ce qui pourrait constituer un danger majeur pour l'Occident, pour l'Europe, pour la France. Voilà les limites que j'ai exprimées, les alertes que j'ai lancées. On est obligés, dans un monde complexe comme le nôtre, de se projeter à moyen et à long termes pour éviter, demain, de créer des dangers majeurs.",2022-04-20T19:31:13.156474Z, M.Le Pen
41," E.Macron, le jour où cette guerre s'arrêtera, faudra-t-il lever immédiatement les sanctions contre la Russie? Les Français pourront-ils considérer V.Poutine comme un partenaire à part entière, un partenaire comme un autre?",2022-04-20T19:34:42.864508Z, G.Bouleau
42," Je prends note des positions de madame Le Pen, qui ne correspondent pas aux positions que vos parlementaires défendent au Parlement européen. Qu'il s'agisse de protéger les Ukrainiens quand ils viennent sur notre sol comme des sanctions additionnelles après le premier paquet, comme de l'aide à l'Ukraine à laquelle vous vous êtes opposée, et je parle bien sûr de l'aide financière.",2022-04-20T19:34:57.133218Z, E.Macron
43, C'est faux.,2022-04-20T19:35:26.751214Z, M.Le Pen
44," C'est un fait. C'est d'ailleurs ce que vous venez de dire. C'est contraire aux positions que vous avez tenues historiquement. Vous avez été l'une des 1res responsables politiques européennes, dès 2014, à reconnaître le résultat de l'annexion de la Crimée. Dans le droit international, on reconnaît rarement des territoires annexés par la force, alors même que V.Poutine avait reconnu que les conditions de ce référendum Vous l'avez fait. Pourquoi? Pour notre pays, c'est une mauvaise nouvelle. Vous dépendez du pouvoir russe. Vous dépendez de monsieur Poutine. Quelques mois après avoir dit ça, vous avez contracté un prêt, en 2015, auprès d'une banque russe. Elle est proche du pouvoir. Vous avez ensuite reboutiqué ce prêt auprès d'autres acteurs. Ces derniers ont été impliqués dans la guerre en Syrie. Vous ne parlez pas à d'autres dirigeants. Vous parlez à votre banquier, quand vous parlez de la Russie. C'est ça, le problème. C'est aussi ce qui fait que, dès qu'il y a des positions courageuses à prendre, ni vous ni vos représentants ne sont là. Ce n'est pas un hasard si, il y a 5 ans, la Russie était intervenue dans la campagne. Ca a été prouvé. Il s'agissait de me déstabiliser. Vous avez toujours été ambiguë sur le sujet. Vous n'êtes pas dans une situation de puissance à puissance. Vous ne pouvez pas défendre les intérêts de la France correctement sur ce sujet parce que vos intérêts sont liés",2022-04-20T19:35:28.840965Z, E.Macron
