id,text,stamp,speaker
109," Vous n'êtes pas davantage juste. Vous ne prenez pas en compte les critères de pénibilité. Un professionnel qui commence un métier pénible à 25 ans devra aller jusqu'à 65 ans. Les critères de pénibilité permettent d'être juste. C'est ça qu'il faut concerter avec les syndicats. Carrière longue, pénibilité, pour les ouvriers agricoles, les gens qui travaillent dans les abattoirs, les travailleurs de nuit, les transporteurs routiers. Troisièmement, il faut supprimer les régimes spéciaux, et donc, les personnes que l'on embauche dans ces régimes, en particulier chez EDF ou à la RATP, doivent rentrer dans le système général. Je fais ça pour financer les progrès. Vous, vous n'expliquez jamais comment vous financez vos progrès. Vous n'êtes pas honnête avec les gens. Moi, j'explique. Pour se faire élire, c'est plus simple de dire que l'on va revenir sur une réforme antérieure. C'est ce que vous faites. Vous revenez sur un système qui n'est déjà pas équilibré. Soit vous avez des impôts cachés, soit vous allez mettre en péril les pensions des retraités.",2022-04-20T20:02:29.539549Z, E.Macron
110," Vous êtes le président qui a créé 600 milliards d'euros de dette supplémentaires en 5 ans, dont les 2/3 n'ont rien à voir avec le covid.",2022-04-20T20:03:40.579240Z, M.Le Pen
111, C'est faux.,2022-04-20T20:03:52.893625Z, E.Macron
112, 600 milliards de dette supplémentaires. Les 2/3 n'ont rien à voir avec le covid. Ce sont les chiffres de vos propres ministères. C'est 145 milliards pour le covid.,2022-04-20T20:03:53.109006Z, M.Le Pen
113," C'est la Sécurité sociale, les collectivités. Arrêtez de tout confondre!",2022-04-20T20:04:01.545420Z, E.Macron
114, Ne me donnez pas de leçons...,2022-04-20T20:04:06.122036Z, M.Le Pen
115, Je connais ce numéro par coeur.,2022-04-20T20:04:08.906124Z, E.Macron
116, Ne me donnez pas de leçons sur le financement de mon projet.,2022-04-20T20:04:11.338032Z, M.Le Pen
117, Elle a 2 minutes de retard.,2022-04-20T20:04:16.938627Z, L.Salamé
118," Revenons sur les 600 milliards de dette. Qu'auriez-vous fait? On a baissé le déficit les premières années du quinquennat. La dette a commencé à être remboursée. Les 600 milliards d'euros de dette, c'est 200 milliards de la partie Etat. Le reste, ce sont les collectivités locales et la Sécurité sociale. Nous n'avons pas prélevé les cotisations car les gens ne pouvaient plus travailler. On a même fait des décalages, des exonérations de cotisations. Le ""quoi qu'il en coûte"", vous avez voté contre. Vous auriez fait quoi?",2022-04-20T20:04:17.802284Z, E.Macron
119, Vous avez 3 minutes de retard. Vous avez la parole.,2022-04-20T20:05:01.976245Z, L.Salamé
120, Ca va me permettre de revenir...,2022-04-20T20:05:05.554791Z, M.Le Pen
121, Vous ne répondez pas à ma question.,2022-04-20T20:05:07.720848Z, E.Macron
122," Je vais répondre à tout, y compris aux choses fausses que vous dites depuis tout à l'heure. Tout à l'heure, vous avez dit que vous aviez baissé le chômage. C'est analysé par le Bureau international du Travail. C'est un chiffrage très contesté. En réalité, il est très restrictif. Les chiffres du chômage, les chômeurs A, B, C, étaient 5,5 millions quand vous avez été élu. Ils sont maintenant 5,4 millions.",2022-04-20T20:05:10.346973Z, M.Le Pen
123, Personne n'a jamais compté les catégories B et C.,2022-04-20T20:05:38.007946Z, E.Macron
124," On transfère les uns et les autres Tout ça, ce sont des statistiques bien connues. Des gens qui cherchent activement un emploi, il y en avait 5,5 millions quand vous avez été élu. Il y en a maintenant 5,4 millions. En matière de succès sur le chômage, permettez-moi d'être dubitative. Vous expliquez que vous avez fait beaucoup d'efforts pour les plus modestes. Ce que je vois, c'est qu'il y a 400 000 pauvres supplémentaires sous votre quinquennat. Dans notre pays, il y a 9,8 millions de pauvres C'est votre résultat, désolée de vous le dire. Vous dites que vous êtes très bon en économie, que les entreprises vous adorent. Il y a 85 milliards de déficit de la balance commerciale. Ce n'est pas un chiffre que l'on peut pipeauter. C'est un record absolu. Le chiffre le plus brutal, le plus cruel pour vous, c'est peut-être le chiffre de la productivité. Le chiffre de la productivité décroche totalement, à compter de votre élection. L'augmentation de la productivité est de 0,1 % alors qu'elle est de 1,8 % pour l'ensemble des pays de l'OCDE. Le Mozart de la finance, c'est comme ça qu'on vous avait présenté... Je ne dis pas que vous le disiez vous-même. En tout cas, vous avez un bilan économique très mauvais. J'ai oublié les 14 500 emplois industriels perdus sous votre quinquennat, et un bilan social qui est encore pire. Quand je viens vous dire qu'il y a un autre projet à mettre en oeuvre, qu'il faut changer les priorités, les méthodes, la manière dont on envisage l'économie, qu'il faut faire du patriotisme économique, de la relocalisation des activités, réindustrialiser notre pays, aider les TPE et les PME en leur accordant des baisses de fiscalité, et pas aux grands groupes, comme vous l'avez fait... Quand vous parlez de baisses d'impôts, vous pensez toujours aux gros et jamais aux petits. Vous parlez des baisses d'impôts pour les Français. Vous avez oublié que la plus grosse baisse, c'était la suppression de l'impôt sur les grandes fortunes.",2022-04-20T20:05:40.897546Z, M.Le Pen
125, Il y a eu aussi la baisse de la flat tax.,2022-04-20T20:08:08.974032Z, M.Le Pen
126," C'est la taxe d'habitation, de très loin.",2022-04-20T20:08:11.446329Z, E.Macron
127, La taxe d'habitation que les Français sont en train de payer par la hausse de la taxe foncière.,2022-04-20T20:08:14.314824Z, M.Le Pen
128," Que tout le monde regarde les chiffres. C'est la taxe d'habitation, de très loin.",2022-04-20T20:08:19.364656Z, E.Macron
129, Vous débattez sur le financement de vos programmes respectifs.,2022-04-20T20:08:24.908410Z, L.Salamé
130," Quelques secondes, E.Macron.",2022-04-20T20:08:27.872671Z, G.Bouleau
131," Madame Le Pen n'a pas répondu sur le covid. J'ai expliqué ce qu'étaient les 600 milliards de dette. Je les assume totalement. On a eu une récession 3 fois plus lourde que pendant la crise financière. On en sort aujourd'hui. Dans votre programme, il n'y a pas le mot ""chômage"". Pourquoi? Parce qu'on a aidé. Vous dites qu'on aide les grands groupes. Les restaurateurs, les commerçants, les artisans, les petits industriels qui nous écoutent aujourd'hui... Qu'ils viennent témoigner! Qu'ils viennent vous parler! Ils vous diront qui les a aidés avec le fonds de solidarité, le chômage partiel, les prêts garantis, la prise en charge de leurs propres cotisations. C'est le gouvernement qui les a aidés. J'en suis fier! On a constitué tous ensemble les 600 milliards de dette. On a vécu une pandémie. Malgré tout, contrairement aux chiffres que vous avez donnés, on a baissé le chômage. Il est passé à 6,4 %. Le Bureau international du Travail est l'organisme qui fait référence. Personne ne compte les catégories B et C du chômage. Ce sont des actifs partiels.",2022-04-20T20:08:32.996262Z, E.Macron
132, Ils seront contents de l'apprendre.,2022-04-20T20:09:44.916390Z, M.Le Pen
133," Ce n'est pas Gérard Majax, ce soir! On parle de vies, derrière. On parle de la vie de commerçants et d'artisans. C'est ça, la dette covid. Vous avez voté contre.",2022-04-20T20:09:57.805478Z, E.Macron
134, Non...,2022-04-20T20:10:12.923304Z, M.Le Pen
135, La députée Le Pen a voté contre.,2022-04-20T20:10:14.827640Z, E.Macron
136, Arrêtez...,2022-04-20T20:10:16.903135Z, M.Le Pen
137, Comment auriez-vous fait? Dites-nous ce que vous auriez fait autrement.,2022-04-20T20:10:18.709193Z, E.Macron
138, En quelques secondes...,2022-04-20T20:10:22.600470Z, G.Bouleau
139," Lors du 1er confinement, j'avais proposé des fonds propres à toutes les TPE et PME. J'avais proposé 1500 euros par entreprise, plus 1000 euros par salarié. C'étaient des fonds propres. Vous avez fait le choix d'un certain nombre de PGE qui doivent être remboursés par les entreprises. Beaucoup vont mourir parce qu'elles n'y arriveront pas.",2022-04-20T20:10:24.901747Z, M.Le Pen
140, On les décale à chaque fois.,2022-04-20T20:10:43.093791Z, E.Macron
141," Vous les inscrivez sur les fichiers des banques en faisant ça. Elles ne peuvent plus investir. Pour tout le reste, j'ai été en désaccord avec vous après le 1er confinement. Vous avez continué les couvre-feux. Vous avez continué de fermer les commerces en considérant qu'il y avait des essentiels et des non-essentiels. J'étais en désaccord avec tout ça. A cette époque-là, après le 1er confinement, on savait qu'en réalité, les petits commerces n'étaient pas des lieux de transmission du virus. Vous avez fait des fermetures administratives. Vous venez expliquer aujourd'hui que les commerçants devraient vous être reconnaissants de leur avoir compensé les pertes que vous avez vous-même suscitées en les fermant de manière administrative? Je ne suis pas d'accord.",2022-04-20T20:10:45.020048Z, M.Le Pen
142, Je n'aurai pas la cruauté de revenir sur la période du covid.,2022-04-20T20:11:28.922884Z, E.Macron
143, Vous pouvez. Ca ne me pose pas problème.,2022-04-20T20:11:32.074155Z, M.Le Pen
144," Les vaccins russes, là encore... Vous proposiez d'administrer Spoutnik V.",2022-04-20T20:11:36.903365Z, E.Macron
145, C'est ce que disait aussi R.Muselier...,2022-04-20T20:11:44.902401Z, M.Le Pen
146," Mais en face de moi, j'ai M.Le Pen.",2022-04-20T20:11:46.748980Z, E.Macron
147," Il vote pour vous, maintenant.",2022-04-20T20:11:50.757690Z, M.Le Pen
148," Quand je regarde comment vos amis ont géré la crise covid, je suis fier de la façon dont on a géré cette crise.",2022-04-20T20:11:52.920190Z, E.Macron
149," Vous voulez parler de la dépendance. On va aussi parler de l'hôpital. Ce sont des sujets majeurs. Revenons sur l'hôpital public. Il est menacé d'effondrement. C'est ce que disent les médecins et les infirmiers. Ils le disent encore plus depuis l'épidémie de covid. Si vous êtes réélu, E.Macron, qu'allez-vous dire aux personnels Ca ira mieux avec vous?",2022-04-20T20:12:01.826996Z, L.Salamé
150," On a une crise à l'hôpital et dans les déserts médicaux, dans beaucoup de nos territoires, qu'il s'agisse des quartiers comme de la grande ruralité. Sur ce sujet, des décisions ont été prises dès 2018. J'ai mis fin aux tarifs hospitaliers. J'ai aussi mis fin au numerus clausus. Malheureusement, ça prend du temps. J'ai une gratitude infinie à l'égard de l'ensemble des soignants. Nous avons pris une décision historique pendant la crise, une décision d'investissement, plus de 19 milliards d'euros dans nos hôpitaux, mais aussi des investissements dans les salaires. On a revalorisé les salaires pour tous les soignants, d'au moins 183 euros par mois. Ca n'avait jamais été fait. Ce n'est pas suffisant. Je sais tout ce que je leur dois. Je sais que la situation est très dure. Il y a un manque historique de médecins, de soignants. On va commencer à améliorer les choses pour les infirmiers et les aides-soignants dans les mois qui viennent. Je sais qu'aujourd'hui, ce sont les conditions de travail qui sont les plus dures. On doit continuer à investir dans notre système de santé pour redresser l'hôpital, pour réembaucher. Il faut attirer les gens et améliorer les conditions. Il faut donc continuer d'y investir. Je propose une série de mesures pour mettre fin aux déserts médicaux. C'est une méthode totalement nouvelle à l'échelle d'un territoire. On va faire travailler nos personnels à l'hôpital avec notre médecine de ville, avec les paramédicaux, les pharmaciens, les infirmiers de ville, les kinés, l'ensemble de ces professions, pour avoir une offre de soins organisée à l'échelle d'un territoire, permettant d'avoir un référent de santé pour nos compatriotes, en particulier pour les plus âgés. On va devoir continuer à investir. C'est dans mon projet.",2022-04-20T20:12:26.792324Z, E.Macron
151," Face à cet effondrement de l'hôpital public, ce qui est constaté par les professionnels de santé, si vous êtes élue présidente, en 2027, l'hôpital ira beaucoup mieux?",2022-04-20T20:14:25.018773Z, G.Bouleau
152," Oui. Je suis frappée d'une chose... Pendant votre quinquennat, vous aurez attendu les crises. Il n'y a que les crises qui arrivent à vous faire bouger. Il a fallu la crise sanitaire pour s'apercevoir que le personnel soignant était dans une souffrance inouie depuis des années. Vous n'avez pas fait preuve de beaucoup d'empathie à son égard. Vous avez licencié 15 000 soignants sans salaire, du jour au lendemain, parce que vous refusez qu'ils puissent tester avant de venir travailler, parce que vous vouliez qu'ils soient à tout prix vaccinés... Ce n'était pas bien de faire ça. Moi, je les réintégrerai. Je leur restituerai le salaire dont ils ont été privés. Encore une fois, il a fallu attendre la crise. L'effondrement de l'hôpital, on le connaissait. Cela faisait déjà 3 ou 4 ans que vous étiez au pouvoir. Vous auriez pu considérer que c'était une urgence. Vous ne l'avez pas fait. C'est l'effondrement. Les infirmiers sont en sous-effectif. Il y a des déserts médicaux. Ca fait des années. Plus personne n'arrive à trouver de médecin. Vous avez supprimé le numerus clausus l'an dernier.",2022-04-20T20:14:36.415791Z, M.Le Pen
153, En 2018.,2022-04-20T20:15:53.107953Z, E.Macron
154," Bref... Je crois qu'il faut investir 20 milliards sur 5 ans. C'est 10 milliards pour la revalorisation du personnel, pour l'embauche de personnels, notamment dans les Ehpad, pour éviter les drames qui ont été révélés, mais aussi la souffrance des soignants et des patients... Tous les infirmiers que j'ai rencontrés... J'en ai rencontré des dizaines, partout, y compris en outre-mer. Ils disent qu'ils n'ont pas le temps pour s'occuper Ils ne sont pas assez. Ils n'ont pas assez de moyens. Ces personnels s'accusaient eux-mêmes. Ils considèrent presque que c'est de la maltraitance. A cette urgence, il faut répondre rapidement. 10 milliards sur la revalorisation salariale, 10 milliards d'investissements dans l'hôpital, dans le matériel. Ce sera financé par le fonds souverain dont nous aurons l'occasion de parler tout à l'heure, je l'espère. C'est sur fonds privés et non sur fonds publics. Il faut développer la télémédecine. Il faut à tout prix mettre en place une incitation fiscale pour les médecins, pour les inciter à s'installer dans certaines zones. C'est l'ensemble de la politique qu'il faut rééquilibrer entre la métropole et la ruralité. Vous aurez beau donner des incitations financières au médecin, s'il ne peut pas venir avec sa femme, si sa femme ne peut pas trouver d'emploi, s'il n'y a pas d'école pour les enfants, pas de transport pour aller à la ville d'à côté, on continuera dans cette désertification, qui est une injustice. C'est ressenti comme une injustice profonde par nos compatriotes.",2022-04-20T20:15:53.970417Z, M.Le Pen
155," Vous avez employé tous les deux le mot ""dépendance"". C'est un sujet qui a profondément touché les Français après la publication d'un livre choc sur les conditions dans lesquelles nos aînés sont traités dans les Ehpad. La question est simple et s'adresse à l'un et à l'autre. Comment faire pour que cela ne se reproduise jamais?",2022-04-20T20:17:44.910560Z, L.Salamé
156," D'abord, il faut contrôler. Il faut contrôler les endroits où les personnes sont vulnérables. C'est une obligation, je le crois. Deuxièmement, il faut imposer un nombre de personnels minimum et être exigeant sur ce sujet, par rapport au nombre de résidents. Il faut à tout prix exiger que les Ehpad aient un médecin coordinateur. Il y a encore 30 % des Ehpad qui n'ont pas de médecin coordinateur. Il faut imposer qu'il y ait une infirmière 24h/24. Il y a encore une part non négligeable des Ehpad qui n'ont pas d'infirmière 24h/24. Je crois qu'il faut réfléchir à un modèle mutualiste des Ehpad. Les Ehpad qui font de l'argent sur le dos des résidents, avec des prix parfois honteux, c'est un modèle qui choque les Français, à juste titre. Faire de l'argent sur la vulnérabilité des personnes âgées, c'est mal accepté, on le comprend. Il faut donc réfléchir à un modèle mutualiste, qui m'apparaît plus adapté, à côté des Ehpad d'Etat, ce qui est parfaitement admissible. Un modèle mutualiste pour pouvoir investir aussi les familles dans la gestion de ces structures.",2022-04-20T20:18:02.239100Z, M.Le Pen
157," Que proposez-vous, E.Macron, pour que ce qui a été dénoncé dans les Ehpad ne se reproduise plus jamais?",2022-04-20T20:19:28.910271Z, G.Bouleau
158," Je n'attends pas la crise. Le plan santé commence en 2018. J'ai été élu en 2017. Le Ségur est en juin 2020. Je voulais rétablir la vérité. Nous n'avions pas eu de pandémie depuis un siècle. Ce réinvestissement massif, je l'assume et je veux avancer dans ce sens. Sur le grand âge, d'abord, l'immense majorité de nos compatriotes qui vieillissent veulent pouvoir vieillir chez eux. Un point important, c'est de les aider à le faire. D'abord, les aider à aménager leur logement. Beaucoup de compatriotes qui nous écoutent veulent pouvoir être aidés. C'est pour ça que je veux mettre un dispositif, Ma Prime Adapt', pour aménager le logement pour monter les quelques marches, pour accéder aux sanitaires, réaménager les choses pour rester à son domicile. Ensuite, il faut pouvoir aider celles et ceux, beaucoup de femmes, qui, pour beaucoup, travaillent sous le salaire minimum. Elles n'ont pas un temps complet de travail. Il faut les aider à avoir leurs 35 heures, c'est-à-dire compléter leur service. Dans le réinvestissement que je veux faire, aux côtés des départements, il s'agit de leur donner un service complet et de leur donner plus d'heures par semaine pour bien s'occuper de nos personnes âgées chez elles. Beaucoup de nos soignants et de nos soignantes culpabilisent parce qu'ils nous disent: ""Je ne fais pas bien mon travail, c'est quasiment de la maltraitance."" Il faut leur donner plus d'heures. Ce n'est pas vrai qu'on fait la toilette le matin en une demi-heure. Ce n'est pas possible. Ensuite, il faut développer des contrôles et des moyens. Il existe déjà des systèmes privés non lucratifs ou mutualistes. J'y suis favorable. Il ne faut pas jeter l'opprobre sur un système privé. Il faut que le système soit régulé et contrôlé. Derrière, les patients sont aidés par la puissance publique. Il faut renforcer massivement les contrôles. On doit aussi créer plus de postes. Je propose 50 000 postes d'infirmiers et infirmières, aides-soignants et aides-soignantes. Nos compatriotes qui arrivent en Ehpad arrivent de plus en plus âgés. Il faut que ce soit de plus en plus médicalisé. Tout cela a un coût. C'est pour cela qu'il faut être cohérent et transparent sur la manière de le financer. Je demande à tout le monde de travailler un peu plus. J'explique comment je finance. J'affiche la couleur.",2022-04-20T20:19:34.508511Z, E.Macron
159, Vous financez tout avec votre retraite.,2022-04-20T20:22:18.199502Z, M.Le Pen
160, Je suis très clair sur les chiffres.,2022-04-20T20:22:21.031819Z, E.Macron
161," La retraite à 65 ans, je rappelle.",2022-04-20T20:22:24.915951Z, M.Le Pen
162," La retraite progressive, madame Le Pen.",2022-04-20T20:22:25.369408Z, E.Macron
163," C'est flou. Moi, j'ai un tableau précis. Chacun peut savoir.",2022-04-20T20:22:27.784503Z, M.Le Pen
164," J'explique que j'ai 9 milliards avec ça, 35 milliards...",2022-04-20T20:22:42.171917Z, E.Macron
165," C'est merveilleux, le plein-emploi.",2022-04-20T20:22:46.260116Z, M.Le Pen
166," On a fait cette économie, madame Le Pen...",2022-04-20T20:22:49.176785Z, E.Macron
167," Nous sommes les gardiens du temps et de la tenue. Nous voulions aborder un thème très important, une angoisse pour les jeunes.",2022-04-20T20:22:51.170699Z, G.Bouleau
168," On reviendra sur le financement, j'imagine?",2022-04-20T20:22:59.707945Z, E.Macron
169," Vous aurez toute latitude de revenir là-dessus. Une angoisse pour les jeunes: l'avenir de la planète. Les experts de l'ONU sur le climat nous ont rappelé que nous n'avions plus que 3 ans pour limiter à un niveau acceptable les émissions de gaz à effet de serre. M.Le Pen, si vous êtes élue présidente de la République, quelles sont les mesures que vous prendrez en ce sens?",2022-04-20T20:23:02.305529Z, G.Bouleau
170," D'abord, j'arrête l'hypocrisie qui consiste à refuser de voir que c'est le modèle économique fondé sur le libre-échange qui est responsable d'une grande partie de l'émission des gaz à effet de serre. En France, c'est 50 %, d'ailleurs. On ne peut pas sérieusement dire qu'on va s'attaquer à ce problème en refusant de voir que c'est les importations qui représentent 50 % de ces gaz à effet de serre. C'est pourquoi je pense que le modèle économique fondé sur le libre-échange, qui consiste à produire à 10 000 km pour consommer 10 000 km plus loin, est un modèle qui tue la planète. J'ai donc conçu l'intégralité de mon projet autour du localisme, de la relocalisation des productions et des activités. Je veux que l'on puisse créer sur place, consommer au plus près, pas tout... Il y a des choses qu'on ne pourra pas fabriquer ou qu'on ne pourra pas cultiver. Mais au maximum, partir sur la relocalisation. Ca veut dire aussi que l'Etat doit assumer cette responsabilité. C'est mettre en place le patriotisme économique, faire en sorte qu'on arrête d'importer la moitié de nos fruits et légumes alors que nous avons parfaitement la capacité de pouvoir répondre à la demande française. C'est par l'intermédiaire du patriotisme économique, faire en sorte que les collectivités, l'Etat, notamment dans la restauration collective, s'engagent à acheter pas bio... Dans le bio, il y a du bio étranger dont les normes sont moins précises qu'en France. Il faut qu'on puisse avoir des produits français dans les cantines collectives de notre pays. C'est essentiel. Quand on parle environnement, il y a une chose dont on ne parle pas souvent: la souffrance animale. Le libre-échange est un modèle qui a fait beaucoup de mal aux animaux. Quand on accepte des circuits qui font qu'on fait naître des bêtes en France, qu'on va les transporter dans des camions, dans des conditions évidemment éprouvantes et douloureuses, à des centaines de kilomètres, pour aller les engraisser, puis à nouveau à des centaines voire à des milliers de kilomètres pour les abattre, c'est un modèle insensé, qui crée du chômage dans notre pays, qui crée des émissions de gaz à effet de serre, 50 %, et qui crée de la souffrance animale. Ca désespère nos agriculteurs, nos industriels parce qu'ils se retrouvent confrontés en plus à une concurrence déloyale car il arrive bien souvent que ces importations ne respectent pas les normes que nous nous sommes choisies comme un choix de société. D'abord, avant de parler d'énergie... Il n'y a pas un thème. Avant de parler d'énergie, un élément fondamental, il y a le modèle économique à remettre en cause. Il y a évidemment des choix énergétiques dont on a déjà un peu parlé tout à l'heure.",2022-04-20T20:23:26.414971Z, M.Le Pen
171," Le parallélisme des questions. Quels sont les 2 engagements que vous vous engagez à tenir si vous êtes réélu pour lutter contre le réchauffement climatique, E.Macron?",2022-04-20T20:26:34.519056Z, L.Salamé
172," Ce qui est intéressant, à vous écouter, c'est l'incohérence de notre conversation. Quand vous parlez de remettre en cause le modèle de libre-échange de nos importations... Nos importations qui nous posent le plus de problèmes, et en termes de déficit commercial et en termes de bilan carbone, c'est notre dépendance aux hydrocarbures. Vous avez proposé la plus grosse subvention aux hydrocarbures possible parce que vous baissez la TVA sur ces derniers. Je dis juste que votre programme n'a ni queue ni tête. Vous proposez une baisse pérenne sur les hydrocarbures, les énergies fossiles très polluantes. Je considère qu'on est sur une controverse claire. Il est très transparent. Vous êtes climatosceptique. C'est net. J'ai un bilan et je veux aller plus vite. On a doublé le rythme de réduction de gaz à effet de serre durant ce quinquennat et lancé une politique pour la biodiversité. Je veux aller 2 fois plus vite dans le quinquennat qui vient. Je mets un Premier ministre en charge de cette politique, en charge de décliner une planification énergétique d'une part et une planification territoriale d'autre part. Pour la production des énergies mais aussi pour la transition. Ensuite, la 2e grande mesure, c'est de continuer à accompagner et des modes de vie. La rénovation thermique des bâtiments pour la sobriété, 700 000 logements par an. On en a fait 650 000 en 2021. Formidable source d'économie d'énergie. C'est un levier aussi de création d'emplois pour nos artisans. 2e chose, c'est aider nos compatriotes à aller vers des véhicules hybrides ou électriques produits en France. de batteries électriques dans la région des Hauts-de-France.",2022-04-20T20:26:52.186970Z, E.Macron
173," M.Le Pen, vous voulez répondre à ce que vient de dire E.Macron?",2022-04-20T20:29:14.086554Z, L.Salamé
